{
  "schema_version": "1",
  "registry_id": "OA6.UNCERTAINTY.REGISTRY.V1",
  "baseline_artifact": "web/public/model/interventions.json",
  "probability_policy": {
    "finite_scenarios_default": "NOT_AVAILABLE",
    "infer_probabilities": false,
    "expected_value_requires_explicit_probabilities": true
  },
  "uncertainties": [
    {
      "id": "UNC.PLANNER.RESPONSE.PROFILES",
      "label": {
        "ro": "Profiluri de răspuns ale parametrilor planner-ului",
        "en": "Planner parameter response profiles"
      },
      "role": "SCIENTIFIC_UNCERTAINTY",
      "uncertainty_type": "PARAMETER",
      "target_ids": [
        "PLANNER.PARAMETER.BETA_F",
        "PLANNER.PARAMETER.BETA_CORRECTION",
        "PLANNER.PARAMETER.BETA_ACCURACY_CUE"
      ],
      "source_kind": "MODEL_ARTIFACT",
      "source_refs": [
        "web/public/model/interventions.json#profiles"
      ],
      "quantification_status": "FINITE_SCENARIOS",
      "probability_status": "NOT_AVAILABLE",
      "reducibility": "PARTLY_REDUCIBLE",
      "decision_relevance": ["RANKING"],
      "limitations": {
        "ro": "Cele trei profiluri variază împreună coeficienții selectați cu ±30%. Sunt scenarii de sensibilitate, nu eșantioane dintr-o distribuție și nu au probabilități implicite.",
        "en": "The three profiles vary selected coefficients together by ±30%. They are sensitivity scenarios, not samples from a distribution, and have no implicit probabilities."
      },
      "finite_scenarios": [
        {
          "id": "low",
          "label": {"ro": "Răspuns redus", "en": "Lower response"},
          "value": 0.7
        },
        {
          "id": "reference",
          "label": {"ro": "Referință", "en": "Reference"},
          "value": 1.0
        },
        {
          "id": "high",
          "label": {"ro": "Răspuns crescut", "en": "Higher response"},
          "value": 1.3
        }
      ]
    },
    {
      "id": "UNC.PLANNER.OBJECTIVE.WEIGHT",
      "label": {
        "ro": "Ponderea obiectivului de reducere a distribuirii false",
        "en": "Weight on the false-sharing reduction objective"
      },
      "role": "DECISION_ASSUMPTION",
      "uncertainty_type": "PREFERENCE",
      "target_ids": ["PLANNER.INPUT.OBJECTIVE_WEIGHT"],
      "source_kind": "USER_INPUT",
      "source_refs": ["web/src/planner.ts#settings.weight"],
      "quantification_status": "BOUNDED_RANGE",
      "probability_status": "NOT_AVAILABLE",
      "reducibility": "USER_CONTROLLED",
      "decision_relevance": ["OBJECTIVE", "RANKING"],
      "limitations": {
        "ro": "Această pondere exprimă o preferință a decidentului între două obiective simulate; nu este parametru științific și nu are distribuție probabilistică implicită.",
        "en": "This weight expresses a decision-maker preference between two simulated objectives; it is not a scientific parameter and has no implicit probability distribution."
      },
      "bounded_range": {
        "minimum": 0,
        "maximum": 100,
        "unit": "percent"
      }
    },
    {
      "id": "UNC.PLANNER.EFFORT.COSTS",
      "label": {
        "ro": "Unități de efort atribuite măsurilor",
        "en": "Effort units assigned to measures"
      },
      "role": "DECISION_ASSUMPTION",
      "uncertainty_type": "IMPLEMENTATION",
      "target_ids": [
        "PLANNER.INPUT.COST.REPETITION",
        "PLANNER.INPUT.COST.CORRECTION",
        "PLANNER.INPUT.COST.ACCURACY",
        "PLANNER.INPUT.COST.SOURCE"
      ],
      "source_kind": "USER_INPUT",
      "source_refs": ["web/src/planner.ts#settings.costs"],
      "quantification_status": "BOUNDED_RANGE",
      "probability_status": "NOT_AVAILABLE",
      "reducibility": "USER_CONTROLLED",
      "decision_relevance": ["COST", "FEASIBILITY", "RANKING"],
      "limitations": {
        "ro": "Unitățile sunt estimări introduse de utilizator și nu reprezintă costuri economice observate sau distribuții ale costului real.",
        "en": "The units are user-entered estimates and do not represent observed economic costs or distributions of real-world cost."
      },
      "bounded_range": {
        "minimum": 1,
        "maximum": 20,
        "unit": "user_supplied_effort_units"
      }
    },
    {
      "id": "UNC.PLANNER.ACTIVATION.TIMING",
      "label": {
        "ro": "Momentul activării intervențiilor",
        "en": "Intervention activation timing"
      },
      "role": "DECISION_ASSUMPTION",
      "uncertainty_type": "SCENARIO",
      "target_ids": ["PLANNER.INPUT.ACTIVATION_STEP"],
      "source_kind": "USER_INPUT",
      "source_refs": [
        "web/src/planner.ts#settings.start",
        "web/public/model/interventions.json#schedules"
      ],
      "quantification_status": "FINITE_SCENARIOS",
      "probability_status": "NOT_AVAILABLE",
      "reducibility": "USER_CONTROLLED",
      "decision_relevance": ["TIMING", "RANKING"],
      "limitations": {
        "ro": "Pașii 2 și 5 sunt alternative de planificare din experimentul demonstrativ. Frecvența lor în interfață nu reprezintă probabilitatea unui moment real de intervenție.",
        "en": "Steps 2 and 5 are planning alternatives in the demonstration experiment. Their presence in the interface does not represent the probability of a real intervention time."
      },
      "finite_scenarios": [
        {
          "id": "early",
          "label": {"ro": "Devreme · pasul 2", "en": "Early · step 2"},
          "value": 2
        },
        {
          "id": "late",
          "label": {"ro": "Mai târziu · pasul 5", "en": "Later · step 5"},
          "value": 5
        }
      ]
    },
    {
      "id": "UNC.PLANNER.STRUCTURAL.SCOPE",
      "label": {
        "ro": "Limitarea structurală a planner-ului M0",
        "en": "Structural scope limitation of the M0 planner"
      },
      "role": "SCIENTIFIC_UNCERTAINTY",
      "uncertainty_type": "STRUCTURAL",
      "target_ids": ["PLANNER.MODEL.M0.INTERVENTIONS"],
      "source_kind": "RESEARCH_CONTRACT",
      "source_refs": [
        "docs/research/OA_R7_DECISION_UNDER_UNCERTAINTY.md",
        "web/src/planner.ts#before-real-world-implementation"
      ],
      "quantification_status": "QUALITATIVE",
      "probability_status": "NOT_AVAILABLE",
      "reducibility": "PARTLY_REDUCIBLE",
      "decision_relevance": ["MODEL_SCOPE", "RANKING"],
      "limitations": {
        "ro": "Stresul, somnul, instituțiile și amplificarea algoritmică nu sunt încă factori executabili în M0. Rezultatele planner-ului nu acoperă aceste căi omise.",
        "en": "Stress, sleep, institutions and algorithmic amplification are not yet executable M0 factors. Planner results do not cover these omitted pathways."
      }
    }
  ]
}
